{
  "name": "restore-cited",
  "relation": "the restore rule carries the approved restore; the break-glass line is declared an anchor beside it on purpose, though the rule alone carries it",
  "locus": "the engine's check of one yes/no question, at its scope, with each case",
  "role": "a person asking the workbench whether an act is permitted",
  "grain": "two statements of the corpus, each cut alone",
  "purpose": "see whether a cited line that carries nothing is told apart from the line that carries the answer",
  "trajectory": "the statements in scope and the case, the engine's check, the answer shown",
  "crossing": "the check's answer line: its status and its text",
  "promise": "the answer is Yes while the restore rule stands; the break-glass line adds nothing alone",
  "baseline": {
    "corpus": "Payments On-Call, the bundled demo, its saved checks of this question",
    "revision": "578493dc7d8554f1a985f1d9eff11e85e8425c5ae7a093830fc1719a6bd4d051",
    "kinds": "each statement's role, as show --json reads it"
  },
  "body": {
    "spans": [
      {
        "id": "s01",
        "text": "Maya, the incident commander, declares a major incident when payment failures last more than ten minutes.",
        "kind": "incident-commander"
      },
      {
        "id": "s02",
        "text": "Maya, the incident commander, may approve a rollback of the payments service.",
        "kind": "incident-commander"
      },
      {
        "id": "s03",
        "text": "Maya, the incident commander, must close a major incident after the release manager confirms that payments are healthy.",
        "kind": "incident-commander"
      },
      {
        "id": "s04",
        "text": "Alex, the on-call engineer, acknowledges every page within five minutes.",
        "kind": "on-call-engineer"
      },
      {
        "id": "s05",
        "text": "Alex, the on-call engineer, checks the payment error rate after acknowledging a page.",
        "kind": "on-call-engineer"
      },
      {
        "id": "s06",
        "text": "Alex, the on-call engineer, may restart the payments service when the error rate stays above five percent.",
        "kind": "on-call-engineer"
      },
      {
        "id": "s07",
        "text": "Morgan, the release manager, freezes deployments during a major incident.",
        "kind": "release-manager"
      },
      {
        "id": "s08",
        "text": "Morgan, the release manager, may roll back the latest payments release after the incident commander approves the rollback.",
        "kind": "release-manager"
      },
      {
        "id": "s09",
        "text": "Morgan, the release manager, confirms that payments are healthy before the incident commander closes a major incident.",
        "kind": "release-manager"
      },
      {
        "id": "s10",
        "text": "Sam, the support lead, posts customer updates after the incident commander declares a major incident.",
        "kind": "support-lead"
      },
      {
        "id": "s11",
        "text": "Sam, the support lead, must not promise a recovery time before the on-call engineer identifies the cause.",
        "kind": "support-lead"
      },
      {
        "id": "s12",
        "text": "Sam, the support lead, collects affected customer reports in the incident channel.",
        "kind": "support-lead"
      },
      {
        "id": "s13",
        "text": "Jordan, the database administrator, may fail over the primary database after the on-call engineer confirms replication lag.",
        "kind": "database-administrator"
      },
      {
        "id": "s14",
        "text": "Jordan, the database administrator, keeps break-glass credentials in the password vault.",
        "kind": "database-administrator"
      },
      {
        "id": "s15",
        "text": "Jordan, the database administrator, may restore the database from a backup only after the incident commander approves the restore.",
        "kind": "database-administrator"
      },
      {
        "id": "s16",
        "text": "Priya, the security engineer, reviews access logs when a payment key is exposed.",
        "kind": "security-engineer"
      },
      {
        "id": "s17",
        "text": "Priya, the security engineer, must rotate a leaked payment key before the incident commander closes the incident.",
        "kind": "security-engineer"
      },
      {
        "id": "s18",
        "text": "Priya, the security engineer, reports a leaked payment key to the incident commander.",
        "kind": "security-engineer"
      },
      {
        "id": "s19",
        "text": "Maya, the incident commander, approves the database vendor invoice.",
        "kind": "incident-commander"
      },
      {
        "id": "s20",
        "text": "A deployment is a change.",
        "kind": "release-manager"
      },
      {
        "id": "s21",
        "text": "If a major incident is open, Morgan, the release manager, does not ship a release.",
        "kind": "release-manager"
      },
      {
        "id": "s22",
        "text": "If a certificate expires, Priya, the security engineer, renews the certificate.",
        "kind": "security-engineer"
      },
      {
        "id": "s23",
        "text": "If Priya renews the certificate, Sam, the support lead, notifies the customers.",
        "kind": "support-lead"
      },
      {
        "id": "s24",
        "text": "Alex, the on-call engineer, reviews access logs after every rollback.",
        "kind": "on-call-engineer"
      },
      {
        "id": "s25",
        "text": "Jordan, the database administrator, tests a backup before restoring it.",
        "kind": "database-administrator"
      },
      {
        "id": "s26",
        "text": "If a payment key leaks, Morgan, the release manager, ships a release.",
        "kind": "release-manager"
      },
      {
        "id": "s27",
        "text": "If a payment key leaks, Priya, the security engineer, renews the certificate.",
        "kind": "security-engineer"
      },
      {
        "id": "s28",
        "text": "Either a certificate expires or a payment key leaks.",
        "kind": "security-engineer"
      },
      {
        "id": "s29",
        "text": "If Priya reviews access logs, she files an audit note.",
        "kind": "security-engineer"
      },
      {
        "id": "s30",
        "text": "On Friday payment failures lasted more than ten minutes, and Maya, the incident commander, did not declare a major incident.",
        "kind": "incident-commander"
      }
    ]
  },
  "anchors": [
    "s15",
    "s14"
  ],
  "inputs": [
    {
      "id": "x",
      "text": "Case: The incident commander has approved the restore.\nQuestion: May Jordan, the database administrator, restore the database from a backup?"
    }
  ],
  "observe": {
    "labels": [
      "Yes",
      "No",
      "conditional",
      "open"
    ],
    "instruction": "Answer the question for the case from the statements above and nothing else: Yes, No, 'conditional' if only under a condition the case does not settle, or 'open' if they do not settle it."
  },
  "interventions": {
    "repeat": true,
    "ablation": true,
    "eachAnchor": true,
    "sham": {
      "draws": 2
    },
    "control": [
      "s01",
      "s02",
      "s03",
      "s04",
      "s05",
      "s06",
      "s07",
      "s08",
      "s09",
      "s10",
      "s11",
      "s12",
      "s13",
      "s14",
      "s15",
      "s16",
      "s17",
      "s18",
      "s19",
      "s20",
      "s21",
      "s22",
      "s23",
      "s24",
      "s25",
      "s26",
      "s27",
      "s28",
      "s29",
      "s30"
    ]
  },
  "allowed": {
    "ablation": [
      "No",
      "open"
    ]
  },
  "standing": {
    "quorum": 5,
    "agree": 4,
    "stable": true
  },
  "materialized": true,
  "carriage": "listed",
  "battery": {
    "kind": "egemma"
  }
}
