{
  "name": "clock-asked",
  "relation": "the request for changes rests on the contributing rule that the time is read only through clock.now()",
  "locus": "the evidence a reviewer has on the pull request: the contributing rules and the pull request; the diff is what is asked about",
  "role": "the reviewer of pull requests",
  "grain": "one contributing rule, and the one call the diff makes",
  "purpose": "hold a change to the repository's own rules, and see that the decision follows the change under review",
  "trajectory": "pull request, evidence, the reviewer's decision, the merge button",
  "crossing": "the decision posted on the pull request",
  "promise": "the reviewer asks for changes because the rule forbids the call; without the rule they approve or say unclear; with the call made through clock.now() they approve",
  "baseline": "the pull request's evidence as it stands, with the diff asked about; nothing changed",
  "body": {
    "spans": [
      {
        "id": "rule",
        "kind": "rule",
        "text": "CONTRIBUTING.md: read the current time only through clock.now(); never call datetime.now() directly, so tests can freeze time."
      },
      {
        "id": "branches",
        "kind": "rule",
        "text": "CONTRIBUTING.md: name each branch after its ticket, like PAY-123-fix-rounding."
      },
      {
        "id": "size",
        "kind": "rule",
        "text": "CONTRIBUTING.md: keep each pull request under 400 changed lines."
      },
      {
        "id": "commits",
        "kind": "rule",
        "text": "CONTRIBUTING.md: write commit messages in the imperative mood."
      },
      {
        "id": "pr",
        "kind": "pr",
        "text": "Pull request #319 from branch PAY-884-due-invoices: 18 changed lines in one commit, \"List invoices due today\"."
      },
      {
        "id": "source",
        "kind": "code",
        "text": "invoices_due_on(day) returns the invoices whose due date is day."
      }
    ]
  },
  "anchors": [
    "rule"
  ],
  "inputs": [
    {
      "id": "review",
      "text": "Review pull request #319. Can it be merged as is?\n\nThe diff adds to src/billing/due.py: due = invoices_due_on(datetime.now().date())"
    }
  ],
  "observe": {
    "labels": [
      "approve",
      "request-changes",
      "unclear"
    ],
    "instruction": "You review pull requests for this repository. Use only the evidence given. Answer approve if the change can be merged as it is, request-changes if it must change before it can be merged, unclear if the evidence does not decide."
  },
  "interventions": {
    "repeat": true,
    "ablation": true,
    "sham": {
      "draws": 2
    },
    "presentation": {
      "invoices_due_on": "bills_due_on",
      "due.py": "billing_day.py",
      "PAY-884": "OPS-220"
    },
    "inputInversion": {
      "datetime.now()": "clock.now()"
    },
    "control": [
      "rule",
      "branches",
      "size",
      "commits",
      "pr",
      "source"
    ]
  },
  "allowed": {
    "ablation": [
      "approve",
      "unclear"
    ],
    "inputInversion": [
      "approve"
    ]
  },
  "standing": {
    "quorum": 5,
    "agree": 4,
    "stable": true
  },
  "materialized": true,
  "carriage": "listed",
  "battery": {
    "kind": "egemma"
  }
}
